Root,No of derevatives found,derevatives found,Root Length,Has Vowel,Full Text
مهك,9, مَهْكَةُ ومُهْكَتُه والمُمَهَّكُ ومَهَكَ مَهْكاً ومَهَّكَه مَهَكْتُ مُهِكَتْ ومَهَكْتُ,3,no vowel, *مهك*	 مَهْكَةُ الشَّبابِ نَفْخَته وامتِلاؤه وارْتِواؤه وماؤه  يقال  شابٌّ [ومُهْكَتُه]  بالضم  أَعلى  والمُمَهَّكُ أَيضاً  الطويل  ومَهَكَ مَهْكاً [ومَهَّكَه]  سحقه فبالغ  ويقال  مَهَكْتُ الشيء إِذا قال النابغة  النُّعْمانِ  حين لَقِيتُه  أَصلابُها والجناجِنُ مُهِكَتْ مُلِّسَتْ  ومَهَكْتُ السهم  مَلَّسْتُه 
مأل,9, مَأْلٌ ومَئِلٌ مَأْلَةٌ مَأَلَ يَمْأَلُ تَمْؤُل مَأَلَ مَأْلاً مَأَلَ,3,vowel, *مأل*	 رجل مَأْلٌ ومَئِلٌ  ضَخم كثير اللحم تارّ  والأُنثى مَأْلَةٌ وقد مَأَلَ يَمْأَلُ  تَمَـَّلأَ وضخُم ؛ التهذيب  وقد مَثِلْتَ [تَمْؤُل]  وجاءه أَمْرٌ ما مَأَلَ له مَأْلاً وما مَأَلَ الأَخيرة عن ابن الأَعرابي  أَي لم يستعدَّ له ولم يشعُر به ؛  ما تَهيَّأَ له  اسم رجل فيمن جعله من هذا الباب  وهو عند سيبويه مَفْعَل وتعليله مذكور في موضعه 
متل,2, مَتَلَ مَتْلاً,3,no vowel, *متل*	 مَتَلَ الشيءَ مَتْلاً  زَعْزَعَهُ أَو حرَّكه 
